{
  "assessment_window": {
    "from": "2026-07-28T00:00:00Z",
    "to": "2026-08-04T00:00:00Z"
  },
  "disclosure_pack": "sovereignty-conformance-disclosure/v1",
  "indicators": {
    "kpi.ai_provider_neutral_binding_ratio@v1": {
      "observed_band": "on_target",
      "outcome": "pass",
      "required_band": "on_target"
    },
    "kpi.backup_integrity_pass_rate@v1": {
      "observed_band": "on_target",
      "outcome": "pass",
      "required_band": "warn"
    },
    "kpi.cloud_posture_coverage@v1": {
      "observed_band": "on_target",
      "outcome": "pass",
      "required_band": "warn"
    },
    "kpi.dependency_free_ratio@v1": {
      "observed_band": "on_target",
      "outcome": "pass",
      "required_band": "warn"
    },
    "kpi.eu_data_residency_declaration_coverage@v1": {
      "observed_band": "on_target",
      "outcome": "pass",
      "required_band": "on_target"
    },
    "kpi.eu_regulatory_reference_coverage@v1": {
      "observed_band": "on_target",
      "outcome": "pass",
      "required_band": "warn"
    },
    "kpi.forward_public_hygiene_high_severity_escape_rate@v1": {
      "observed_band": "on_target",
      "outcome": "pass",
      "required_band": "warn"
    },
    "kpi.gdpr_lawful_basis_section_coverage@v1": {
      "observed_band": "on_target",
      "outcome": "pass",
      "required_band": "on_target"
    },
    "kpi.lm_endpoint_eu_residency_coverage@v1": {
      "observed_band": "warn",
      "outcome": "fail",
      "required_band": "on_target"
    },
    "kpi.non_eu_saas_free_workflow_ratio@v1": {
      "observed_band": "on_target",
      "outcome": "pass",
      "required_band": "warn"
    },
    "kpi.notification_sla_compliance@v1": {
      "observed_band": "on_target",
      "outcome": "pass",
      "required_band": "warn"
    },
    "kpi.reference_deployment_target_coverage@v1": {
      "observed_band": "on_target",
      "outcome": "pass",
      "required_band": "on_target"
    },
    "kpi.sovereign_cloud_provider_diversity@v1": {
      "observed_band": "on_target",
      "outcome": "pass",
      "required_band": "warn"
    },
    "kpi.sovereign_object_storage_binding_coverage@v1": {
      "observed_band": "on_target",
      "outcome": "pass",
      "required_band": "on_target"
    },
    "kpi.unmanaged_asset_cardinality@v1": {
      "observed_band": "warn",
      "outcome": "pass",
      "required_band": "warn"
    },
    "kri.cloud_container_unclassifiable_scope_count@v1": {
      "observed_band": "warn",
      "outcome": "pass",
      "required_band": "warn"
    },
    "kri.cross_border_transfer_exposure_count@v1": {
      "observed_band": "on_target",
      "outcome": "pass",
      "required_band": "on_target"
    },
    "kri.declared_target_without_example_count@v1": {
      "observed_band": "on_target",
      "outcome": "pass",
      "required_band": "on_target"
    },
    "kri.hardcoded_non_eu_endpoint_reference_count@v1": {
      "observed_band": "on_target",
      "outcome": "pass",
      "required_band": "on_target"
    },
    "kri.lawful_basis_undocumented_surface_count@v1": {
      "observed_band": "on_target",
      "outcome": "pass",
      "required_band": "on_target"
    },
    "kri.lm_endpoint_unknown_residency_exposure@v1": {
      "observed_band": "warn",
      "outcome": "pass",
      "required_band": "warn"
    },
    "kri.non_eu_critical_dependency_count@v1": {
      "observed_band": "high",
      "outcome": "fail",
      "required_band": "warn"
    },
    "kri.non_eu_lm_endpoint_escape_rate@v1": {
      "observed_band": "on_target",
      "outcome": "pass",
      "required_band": "on_target"
    },
    "kri.non_eu_vendor_sdk_exposure@v1": {
      "observed_band": "warn",
      "outcome": "pass",
      "required_band": "warn"
    },
    "kri.object_storage_unknown_jurisdiction_exposure@v1": {
      "observed_band": "on_target",
      "outcome": "pass",
      "required_band": "warn"
    },
    "kri.unresolvable_regulatory_reference_count@v1": {
      "observed_band": "on_target",
      "outcome": "pass",
      "required_band": "on_target"
    }
  },
  "pass": false,
  "profile": "profile.sovereignty_conformance@v1",
  "provenance": {
    "evaluator": "compilers._shared.evidence.sovereignty_profile",
    "renderer": "render-disclosure-pack",
    "renderer_version": "1.0.0"
  },
  "record": "794f3ac4b08f4cf2e88620177aa26abc2e1dc3ae3d8746e23940f3aee2e7cf0a",
  "record_sha256": "b808f462f1b311959e2a9d00c779a07ad1db36406eee268b46c9aba071bd207b"
}
